{
    "cldr": "48.0.0",
    "calendar": "gregory",
    "hourCycle": "h12",
    "time": [
        { "f": "dayPeriod" },
        { "f": "hour" },
        { "l": ":" },
        { "f": "minute", "p": true },
        { "l": ":" },
        { "f": "second", "p": true }
    ],
    "calendars": {
        "buddhist": {
            "date": [
                { "f": "era" },
                { "f": "year" },
                { "l": "年" },
                { "f": "month" },
                { "l": "月" },
                { "f": "day" },
                { "l": "日" }
            ],
            "eras": { "be": "佛曆" }
        },
        "chinese": {
            "date": [
                { "f": "relatedYear" },
                { "l": "/" },
                { "f": "month" },
                { "l": "/" },
                { "f": "day" }
            ]
        },
        "coptic": {
            "date": [
                { "f": "era" },
                { "l": " " },
                { "f": "year" },
                { "l": "年" },
                { "f": "month" },
                { "l": "月" },
                { "f": "day" },
                { "l": "日" }
            ],
            "eras": { "am": "AM" }
        },
        "dangi": {
            "date": [
                { "l": "/" },
                { "f": "month" },
                { "l": "/" },
                { "f": "day" }
            ]
        },
        "ethioaa": {
            "date": [
                { "f": "era" },
                { "l": " " },
                { "f": "year" },
                { "l": "年" },
                { "f": "month" },
                { "l": "月" },
                { "f": "day" },
                { "l": "日" }
            ],
            "eras": { "aa": "AA" }
        },
        "ethiopic": {
            "date": [
                { "f": "era" },
                { "l": " " },
                { "f": "year" },
                { "l": "年" },
                { "f": "month" },
                { "l": "月" },
                { "f": "day" },
                { "l": "日" }
            ],
            "eras": { "am": "AM" }
        },
        "gregory": {
            "date": [
                { "f": "year" },
                { "l": "年" },
                { "f": "month" },
                { "l": "月" },
                { "f": "day" },
                { "l": "日" }
            ]
        },
        "hebrew": {
            "date": [
                { "f": "era" },
                { "f": "year" },
                { "l": "年" },
                { "f": "month" },
                { "l": "月" },
                { "f": "day" },
                { "l": "日" }
            ],
            "eras": { "am": "創世紀元" }
        },
        "indian": {
            "date": [
                { "f": "era" },
                { "l": " " },
                { "f": "year" },
                { "l": "年" },
                { "f": "month" },
                { "l": "月" },
                { "f": "day" },
                { "l": "日" }
            ],
            "eras": { "shaka": "印度曆" }
        },
        "islamic-civil": {
            "date": [
                { "f": "era" },
                { "f": "year" },
                { "l": "年" },
                { "f": "month" },
                { "l": "月" },
                { "f": "day" },
                { "l": "日" }
            ],
            "eras": { "ah": "BH" }
        },
        "islamic-tbla": {
            "date": [
                { "f": "era" },
                { "f": "year" },
                { "l": "年" },
                { "f": "month" },
                { "l": "月" },
                { "f": "day" },
                { "l": "日" }
            ],
            "eras": { "ah": "BH" }
        },
        "islamic-umalqura": {
            "date": [
                { "f": "era" },
                { "f": "year" },
                { "l": "年" },
                { "f": "month" },
                { "l": "月" },
                { "f": "day" },
                { "l": "日" }
            ],
            "eras": { "ah": "BH" }
        },
        "japanese": {
            "date": [
                { "f": "era" },
                { "f": "year" },
                { "l": "年" },
                { "f": "month" },
                { "l": "月" },
                { "f": "day" },
                { "l": "日" }
            ],
            "eras": {
                "meiji": "明治",
                "taisho": "大正",
                "showa": "昭和",
                "heisei": "平成",
                "reiwa": "令和"
            }
        },
        "persian": {
            "date": [
                { "f": "era" },
                { "l": " " },
                { "f": "year" },
                { "l": "年" },
                { "f": "month" },
                { "l": "月" },
                { "f": "day" },
                { "l": "日" }
            ],
            "eras": { "ap": "波斯曆" }
        },
        "roc": {
            "date": [
                { "f": "era" },
                { "f": "year" },
                { "l": "年" },
                { "f": "month" },
                { "l": "月" },
                { "f": "day" },
                { "l": "日" }
            ],
            "eras": { "roc": "民國" }
        },
        "iso8601": {
            "date": [
                { "f": "year" },
                { "l": "年" },
                { "f": "month" },
                { "l": "月" },
                { "f": "day" },
                { "l": "日" }
            ]
        }
    },
    "dayPeriods": { "am": "上午", "pm": "下午" },
    "zones": {
        "Pacific/Honolulu": "檀香山",
        "Pacific/Pago_Pago": "巴哥巴哥",
        "Pacific/Rarotonga": "拉羅湯加",
        "Pacific/Easter": "復活島",
        "Pacific/Galapagos": "加拉巴哥群島",
        "Pacific/Fiji": "斐濟",
        "Pacific/Truk": "楚克",
        "Pacific/Ponape": "波納佩",
        "Pacific/Kosrae": "科斯瑞",
        "Pacific/Guam": "關島",
        "Pacific/Enderbury": "坎頓島",
        "Pacific/Kiritimati": "基里地馬地島",
        "Pacific/Tarawa": "塔拉瓦",
        "Pacific/Kwajalein": "瓜加林島",
        "Pacific/Majuro": "馬朱諾",
        "Pacific/Saipan": "塞班",
        "Pacific/Noumea": "諾美亞",
        "Pacific/Norfolk": "諾福克",
        "Pacific/Nauru": "諾魯",
        "Pacific/Niue": "紐埃島",
        "Pacific/Chatham": "查坦",
        "Pacific/Auckland": "奧克蘭",
        "Pacific/Tahiti": "大溪地",
        "Pacific/Marquesas": "馬可薩斯島",
        "Pacific/Gambier": "甘比爾群島",
        "Pacific/Port_Moresby": "莫士比港",
        "Pacific/Bougainville": "布干維爾",
        "Pacific/Pitcairn": "皮特肯群島",
        "Pacific/Palau": "帛琉",
        "Pacific/Guadalcanal": "瓜達康納爾島",
        "Pacific/Fakaofo": "法考福",
        "Pacific/Tongatapu": "東加塔布島",
        "Pacific/Funafuti": "富那富提",
        "Pacific/Midway": "中途島",
        "Pacific/Wake": "威克",
        "Pacific/Efate": "埃法特",
        "Pacific/Wallis": "瓦利斯",
        "Pacific/Apia": "阿皮亞",
        "Europe/Andorra": "安道爾",
        "Europe/Tirane": "地拉那",
        "Europe/Vienna": "維也納",
        "Europe/Mariehamn": "瑪麗港",
        "Europe/Sarajevo": "塞拉耶佛",
        "Europe/Brussels": "布魯塞爾",
        "Europe/Sofia": "索菲亞",
        "Europe/Minsk": "明斯克",
        "Europe/Zurich": "蘇黎世",
        "Europe/Prague": "布拉格",
        "Europe/Busingen": "布辛根",
        "Europe/Berlin": "柏林",
        "Europe/Copenhagen": "哥本哈根",
        "Europe/Tallinn": "塔林",
        "Europe/Madrid": "馬德里",
        "Europe/Helsinki": "赫爾辛基",
        "Europe/Paris": "巴黎",
        "Europe/London": "倫敦",
        "Europe/Guernsey": "根息島",
        "Europe/Gibraltar": "直布羅陀",
        "Europe/Athens": "雅典",
        "Europe/Zagreb": "札格瑞布",
        "Europe/Budapest": "布達佩斯",
        "Europe/Dublin": "都柏林",
        "Europe/Isle_of_Man": "曼島",
        "Europe/Rome": "羅馬",
        "Europe/Jersey": "澤西島",
        "Europe/Vaduz": "瓦都茲",
        "Europe/Vilnius": "維爾紐斯",
        "Europe/Luxembourg": "盧森堡",
        "Europe/Riga": "里加",
        "Europe/Monaco": "摩納哥",
        "Europe/Chisinau": "基西紐",
        "Europe/Podgorica": "波多里察",
        "Europe/Skopje": "史高比耶",
        "Europe/Malta": "馬爾他",
        "Europe/Amsterdam": "阿姆斯特丹",
        "Europe/Oslo": "奧斯陸",
        "Europe/Warsaw": "華沙",
        "Europe/Lisbon": "里斯本",
        "Europe/Bucharest": "布加勒斯特",
        "Europe/Belgrade": "貝爾格勒",
        "Europe/Kaliningrad": "加里寧格勒",
        "Europe/Moscow": "莫斯科",
        "Europe/Volgograd": "伏爾加格勒",
        "Europe/Saratov": "薩拉托夫",
        "Europe/Astrakhan": "阿斯特拉罕",
        "Europe/Ulyanovsk": "烏里揚諾夫斯克",
        "Europe/Kirov": "基洛夫",
        "Europe/Samara": "沙馬拉",
        "Europe/Stockholm": "斯德哥爾摩",
        "Europe/Ljubljana": "盧比安納",
        "Europe/Bratislava": "布拉提斯拉瓦",
        "Europe/San_Marino": "聖馬利諾",
        "Europe/Istanbul": "伊斯坦堡",
        "Europe/Kiev": "基輔",
        "Europe/Simferopol": "辛非洛浦",
        "Europe/Vatican": "梵蒂岡",
        "Asia/Dubai": "杜拜",
        "Asia/Kabul": "喀布爾",
        "Asia/Yerevan": "葉里溫",
        "Asia/Baku": "巴庫",
        "Asia/Dhaka": "達卡",
        "Asia/Bahrain": "巴林",
        "Asia/Brunei": "汶萊",
        "Asia/Thimphu": "廷布",
        "Asia/Urumqi": "烏魯木齊",
        "Asia/Shanghai": "上海",
        "Asia/Nicosia": "尼古西亞",
        "Asia/Famagusta": "法馬古斯塔",
        "Asia/Tbilisi": "第比利斯",
        "Asia/Hong_Kong": "香港",
        "Asia/Jakarta": "雅加達",
        "Asia/Pontianak": "坤甸",
        "Asia/Makassar": "馬卡沙爾",
        "Asia/Jayapura": "加亞布拉",
        "Asia/Jerusalem": "耶路撒冷",
        "Asia/Calcutta": "加爾各答",
        "Asia/Baghdad": "巴格達",
        "Asia/Tehran": "德黑蘭",
        "Asia/Amman": "安曼",
        "Asia/Tokyo": "東京",
        "Asia/Bishkek": "比什凱克",
        "Asia/Phnom_Penh": "金邊",
        "Asia/Pyongyang": "平壤",
        "Asia/Seoul": "首爾",
        "Asia/Kuwait": "科威特",
        "Asia/Aqtau": "阿克套",
        "Asia/Oral": "烏拉爾",
        "Asia/Atyrau": "阿特勞",
        "Asia/Aqtobe": "阿克托比",
        "Asia/Qostanay": "庫斯塔奈",
        "Asia/Qyzylorda": "克孜勒奧爾達",
        "Asia/Almaty": "阿拉木圖",
        "Asia/Vientiane": "永珍",
        "Asia/Beirut": "貝魯特",
        "Asia/Colombo": "可倫坡",